<?xml version="1.0" encoding="UTF-8"?>
<config-description:config-descriptions
	xmlns:xsi="http://www.w3.org/2001/XMLSchema-instance"
	xmlns:config-description="https://openhab.org/schemas/config-description/v1.0.0"
	xsi:schemaLocation="https://openhab.org/schemas/config-description/v1.0.0
	https://openhab.org/schemas/config-description-1.0.0.xsd">

	<config-description uri="system:i18n">
		<parameter name="language" type="text">
			<label>Language</label>
			<description>The default language that should be used. If not specified, the system default locale is used.</description>
		</parameter>
		<parameter name="script" type="text">
			<label>Script</label>
			<description>The script that should be used.</description>
			<advanced>true</advanced>
		</parameter>
		<parameter name="region" type="text">
			<label>Country / Region</label>
			<description>The region that should be used.</description>
		</parameter>
		<parameter name="variant" type="text">
			<label>Variant</label>
			<description>A variation of the Locale. Any arbitrary value used to indicate a variation of a Locale.</description>
			<advanced>true</advanced>
		</parameter>
		<parameter name="timezone" type="text">
			<label>Time Zone</label>
			<description>A time zone can be set from the user interface. The underlying system's time zone is the default.</description>
		</parameter>
		<parameter name="location" type="text">
			<context>location</context>
			<label>Location</label>
			<description><![CDATA[The location of this installation.<br>Coordinates as &lt;latitude&gt;,&lt;longitude&gt;[&lt;altitude&gt;]<br>Example: "52.5200066,13.4049540" (Berlin)]]></description>
		</parameter>
		<parameter name="measurementSystem" type="text">
			<label>Measurement System</label>
			<description>The measurement system is used for unit conversion.</description>
			<advanced>true</advanced>
			<options>
				<option value="SI">Metric</option>
				<option value="US">Imperial (US)</option>
			</options>
		</parameter>
	</config-description>

</config-description:config-descriptions>
