<?xml version="1.0" encoding="UTF-8"?>
<config-description:config-descriptions
	xmlns:xsi="http://www.w3.org/2001/XMLSchema-instance"
	xmlns:config-description="https://openhab.org/schemas/config-description/v1.0.0"
	xsi:schemaLocation="https://openhab.org/schemas/config-description/v1.0.0
		https://openhab.org/schemas/config-description-1.0.0.xsd">

	<config-description uri="system:marketplace">
		<parameter name="showUnpublished" type="boolean">
			<label>Show Unpublished Entries</label>
			<default>false</default>
			<description>Include entries which have not been tagged as published. Warning: this may include entries that are not
				ready and might not work or harm your installation. Enable at your own risk, for testing purposes only.</description>
		</parameter>
		<parameter name="apiKey" type="text">
			<advanced>true</advanced>
			<label>API Key for community.openhab.org</label>
			<description>Specify the API key to use on the community forum (for staff and curators - this allows for instance to
				see content which is not yet reviewed or otherwise hidden from the general public). Leave blank if you don't have
				one.</description>
		</parameter>
	</config-description>

	<config-description uri="system:jsonaddonservice">
		<parameter name="urls" type="text">
			<label>Add-on Service URLs</label>
			<description>Pipe (|) separated list of URLS that provide 3rd party add-on services via Json files. Warning: Bundles
				distributed over 3rd party addon services may lack proper review and can potentially contain malicious code and thus
				harm your system.</description>
		</parameter>
		<parameter name="showUnstable" type="boolean">
			<label>Show Non-Stable Bundles</label>
			<default>false</default>
			<description>Include entries which have not been tagged as "stable". These bundles should be used for testing
				purposes only and are not considered production-system ready.</description>
		</parameter>
	</config-description>

</config-description:config-descriptions>
