<?xml version="1.0" encoding="UTF-8"?>
<config-description:config-descriptions
	xmlns:xsi="http://www.w3.org/2001/XMLSchema-instance"
	xmlns:config-description="http://eclipse.org/smarthome/schemas/config-description/v1.0.0"
	xsi:schemaLocation="http://eclipse.org/smarthome/schemas/config-description/v1.0.0
		http://eclipse.org/smarthome/schemas/config-description-1.0.0.xsd">

	<config-description uri="system:audio">
		<parameter name="defaultSource" type="text" required="false">
			<label>Default Source</label>
			<description>The default audio source to use if no other is specified.</description>
		</parameter>
		<parameter name="defaultSink" type="text" required="false">
			<label>Default Sink</label>
			<description>The default audio sink to use if no other is specified.</description>
		</parameter>
	</config-description>

</config-description:config-descriptions>
