<?xml version="1.0" encoding="UTF-8"?>
<config-description:config-descriptions xmlns:xsi="http://www.w3.org/2001/XMLSchema-instance"
	xmlns:config-description="http://eclipse.org/smarthome/schemas/config-description/v1.0.0"
	xsi:schemaLocation="http://eclipse.org/smarthome/schemas/config-description/v1.0.0 http://eclipse.org/smarthome/schemas/config-description-1.0.0.xsd">

	<config-description uri="voice:opennlphli">
		<parameter name="theme" type="text" required="true">
			<label>Tokenizer</label>
			<description>The alphanumeric tokenizer removes punctuation and might help with languages where entities might not always be enclosed between whitespaces (French, Spanish, Italian... Example: "l'humidit√©", "l'alarme")</description>
			<options>
				<option value="whitespace">Whitespace</option>
				<option value="alphanumeric">Alphanumeric</option>
			</options>
			<default>whitespace</default>
		</parameter>
	</config-description>

</config-description:config-descriptions>
