<?xml version="1.0" encoding="UTF-8"?>
<config-description:config-descriptions
	xmlns:xsi="http://www.w3.org/2001/XMLSchema-instance"
	xmlns:config-description="https://openhab.org/schemas/config-description/v1.0.0"
	xsi:schemaLocation="https://openhab.org/schemas/config-description/v1.0.0 https://openhab.org/schemas/config-description-1.0.0.xsd">

	<config-description uri="system:chaininghli">
		<parameter name="primaryInterpreter" type="text" required="true">
			<label>Primary Interpreter</label>
			<description>The primary human language interpreter to evaluate commands first.</description>
			<default>system</default>
		</parameter>
		<parameter name="secondaryInterpreter" type="text">
			<label>Secondary Interpreter</label>
			<description>The secondary human language interpreter to fall back to if the primary interpreter cannot process the
				command.</description>
		</parameter>
		<parameter name="tertiaryInterpreter" type="text">
			<label>Tertiary Interpreter</label>
			<description>The tertiary human language interpreter to fall back to if both primary and secondary interpreters fail.</description>
		</parameter>
	</config-description>

</config-description:config-descriptions>
