<?xml version="1.0" encoding="UTF-8"?>
<config-description:config-descriptions
	xmlns:xsi="http://www.w3.org/2001/XMLSchema-instance"
	xmlns:config-description="https://openhab.org/schemas/config-description/v1.0.0"
	xsi:schemaLocation="https://openhab.org/schemas/config-description/v1.0.0 https://openhab.org/schemas/config-description-1.0.0.xsd">

	<config-description uri="profile:system:hysteresis">
		<parameter name="lower" type="text" required="true">
			<label>Lower Bound</label>
			<description>Maps to OFF if value is less than or equal to lower bound (plain number or number with unit).</description>
		</parameter>
		<parameter name="upper" type="text">
			<label>Upper Bound</label>
			<description>Maps to ON if value is greater than or equal to upper bound (plain number or number with unit).</description>
		</parameter>
		<parameter name="inverted" type="boolean">
			<label>Inverted</label>
			<description>Inverts resulting mapping of ON / OFF, if true.</description>
			<default>false</default>
		</parameter>
		<parameter name="excludeItemState" type="boolean">
			<label>Exclude Item State</label>
			<description>Do not include Item State in comparison.</description>
			<default>false</default>
		</parameter>
	</config-description>
</config-description:config-descriptions>
