<?xml version="1.0" encoding="UTF-8"?>
<config-description:config-descriptions
	xmlns:xsi="http://www.w3.org/2001/XMLSchema-instance"
	xmlns:config-description="https://openhab.org/schemas/config-description/v1.0.0"
	xsi:schemaLocation="https://openhab.org/schemas/config-description/v1.0.0 https://openhab.org/schemas/config-description-1.0.0.xsd">

	<config-description uri="profile:system:script">
		<parameter name="toItemScript" type="text">
			<label>To Item Script</label>
			<description>The Script for transforming states and commands from handler to item.</description>
		</parameter>
		<parameter name="toHandlerScript" type="text">
			<label>To Handler Script</label>
			<description>The Script for transforming states and commands from item to handler.</description>
		</parameter>
	</config-description>

</config-description:config-descriptions>
