<?xml version="1.0" encoding="UTF-8"?>
<config-description:config-descriptions xmlns:xsi="http://www.w3.org/2001/XMLSchema-instance"
	xmlns:config-description="http://eclipse.org/smarthome/schemas/config-description/v1.0.0"
	xsi:schemaLocation="http://eclipse.org/smarthome/schemas/config-description/v1.0.0
	http://eclipse.org/smarthome/schemas/config-description-1.0.0.xsd">

	<config-description uri="automationAction:magicMultiAction">
		<parameter name="textParam" type="text">
			<label>text parameter</label>
			<description>Enter a text message.</description>
		</parameter>
		<parameter name="boolParam" type="boolean">
			<label>Enable parameter</label>
			<description>Enable this parameter.</description>
			<default>true</default>
			<advanced>true</advanced>
		</parameter>
	</config-description>

</config-description:config-descriptions>
