<?xml version="1.0" encoding="UTF-8"?>
<config-description:config-descriptions
	xmlns:xsi="http://www.w3.org/2001/XMLSchema-instance"
	xmlns:config-description="https://openhab.org/schemas/config-description/v1.0.0"
	xsi:schemaLocation="https://openhab.org/schemas/config-description/v1.0.0 https://openhab.org/schemas/config-description-1.0.0.xsd">

	<config-description uri="system:restauth">
		<parameter name="allowBasicAuth" type="boolean" required="false">
			<label>Allow Basic Authentication</label>
			<default>false</default>
			<description>Allow the use of Basic authentication to access protected API resources, in addition to access tokens
				and API tokens.</description>
		</parameter>
		<parameter name="cacheExpiration" type="integer">
			<advanced>true</advanced>
			<label>Cache Expiration Time</label>
			<default>6</default>
			<unitLabel>h</unitLabel>
			<description>When basic authentication is activated, credentials are put in a cache in order to speed up request
				authorization.
				The entries in the cache expire after a while in order to not keep credentials in memory indefinitely.
				This value defines the expiration time in hours.
			</description>
		</parameter>
		<parameter name="implicitUserRole" type="boolean" required="false">
			<advanced>true</advanced>
			<label>Implicit user role for unauthenticated requests</label>
			<default>true</default>
			<description>By default, operations requiring the "user" role are available when unauthenticated. Disabling this
				option will enforce authorization for these operations. Warning: This causes clients that do not
				support
				authentication to break.</description>
		</parameter>
	</config-description>

</config-description:config-descriptions>
